{
  "FileTypeIdentifier": "This is a EMPI-RF metadata File. Do not change this for crawler identification",
  "Identifier": "Spray-Exp_002",
  "SampleID": "FexOy-0001-BFR",
  "Creator": "Max Mustermann",
  "ORCID": "5558-8885-5589-8569",
  "Date": "2026-02-03",
  "Time": "11:45:43",
  "ReactorType": "Spray Flame Reactor 5",
  "PrecursorSolution": "FeNO3",
  "PrecursorConcentration": 1,
  "SprayFlowRate": 1,
  "CarrierGas": "air",
  "CarrierGasFlowRate": 1,
  "FlameTemperature": 1500,
  "CombustionEquivalenceRatio": 0.8,
  "SchemaID": "nanoparticle_synthesis_conditions"
}